Machine Learning,,
The shape of graphs (concavity),Deep Learning (§22),"The discussions of activation functions on page 804 includes discussion of derivatives and function shape: ""Notice that all of them are monotonically nondecreasing,
which means that their derivatives g' are nonnegative"".  (see also the discussion of the ""vanishing gradient"" problem at the top of page 807.  The shape of various activation functions has proven to be quite important in the study of neural networks and deep learning!"
Optimization,Learning from Examples (§19),Optimizing parameters over a loss function involves applied optimization.
Optimization,Learning Probabilistic Models (§21),Optimizing parameters to identify an MLE or MAP estimate is an optimization
Optimization,Deep Learning (§22),Optimizing parameters over a loss function involves applied optimization.
Optimization,Robotics (§26),Optial control focuses on using gradients for optimization.
Newton's method,Search in Complex Environments (§4),One local search technique for continous spaces is steepest-hill hill climbing (aka gradient ascent) uses gradient and partial derivatives. (pages 137-139). Another technique is the Newton-Raphson method which uses the derivative. (page 139) Understand that the gradient consists of several (partial) derivatives. Use differential rules. Use Newton's method
Definite integrals,Probabilistic Reasoning (§13),"As discussed in Application to probability, a soft threshold is defined using the integral of the standard normal. Having some knowledge about the big idea of an integral seems like it would help with understanding."
Definite integrals,Probabilistic Reasoning over Time (§14),The derivation of the closed forms for the forward step require on integration.
Definite integrals,Learning Probabilistic Models (§21),"The integral of a Gaussian is taken, and the fact that this must be equal to 1 is used."
Definite integrals,Robotics (§26),Integrals are used extensively in the planning and control section.
The fundamental theorem of calculus,Making Simple Decisions (§15),"On page 527, ""The probability density function is the derivative of the cumulative distribution function, so the density for X , the maximum of k estimates, is..."".  I would argue that to understand the relationship between the PDF and the CDF in probability, you really need to understand the fundamental theorem of calculus (at a conceptual level)."
Indefinite integrals and the net change theorem,Deep Learning (§22),Cross-entropy is defined in terms of an integral. Integrals are also used in the variational inference section to deal with KL divergence.
Integrals of exponential and logarithmic functions,Probabilistic Reasoning over Time (§14),"The one-step predicted distribution, expressed as an integral, is computed. (page 499)"
Integrals of exponential and logarithmic functions,Learning Probabilistic Models (§21),"A probability, expressed as an integral, is computed. (page 785)"
Calculus II,,
Application to probability,Probabilistic Reasoning (§13),A soft thereshold is defined using the integral of the standard normal distribution. (page 441)
Application to probability,Probabilistic Reasoning over Time (§14),The one-step predicted distribution is expressed as an integral. (page 497)
Application to probability,Making Simple Decisions (§15),The concept of an action stochastically domining another action is formally defined using integrals. (page 531) An example of stochastic dominacy is shown. (page 532) A reasoning based on integral is shown. (page 546)
Application to probability,Learning Probabilistic Models (§21),"A probability, expressed as an integral, is computed. (page 785)"
Application to probability,Deep Learning (§22),The cross-entry loss is defined an an integral. (page 809) The probability is expressed as an integral. (page 828) The KL divergence is expressed as an integral. (page 829)
Application to probability,Robotics (§26),The recursive filtering equation is expressed using an integral. (page 939) The functional J is expressed as an integral. (page 956) Several concepts are expressed as integrals
Introducing the concept of differential equations,Robotics (§26),A differential equation is solved to compute the theta function. (page 957)
Series,Making Complex Decisions (§16),A geometric series is used. (page 572)
Taylor series,Robotics (§26),"Page 942.  On the right, this function is approximated by a linear function. This linear function is tangent to f at the point  t , the mean of our state estimate at time t. Such a linearization is called first degree Taylor expansion."
Computer Graphics,,
Calculus topic,CS topic,"Rationale (Note: Unless mentioned otherwise, all chapters and sections refer to Marschner, Shirley, Fundamentals of Computer Graphics, 4th edition.)"
Calculus I,,
Limits at infinity and infinite limits,Defining/Storing/Rendering (§22) [all],Behaviour of Ricci blend at the two ends expressed as limits to infinity and negative infinity. (page 602)
"Continuity, discontinuities, and the intermediate value theorem","Signal Processing Concepts (§9)  [§9.1, §9.2, §9.3, §9.4]","In graphics, we often deal with functions of a continuous variable. (page 183) Discontinuity in filters are discussed. (page 205)"
"Continuity, discontinuities, and the intermediate value theorem","Blending Functions, Bézier/Hermite, Catmull-Rom, Interpolating vs. Approximating, Subdivision (curves and surfaces), Picewise Curves/Splines (§15) [all]",Continuity. (page 366)
Motivating the need for the derivative and introducing the derivative concept,"Composition (§20) [§20.1, §20.2]",The approximation tan θ ≈ θ is used for small θ. (page 538)
Motivating the need for the derivative and introducing the derivative concept,"Vectors, Curves/Surfaces (§2) [all]",Understand that the gradient consists of several (partial) derivatives. (page 31) Derivative defined as a limit. (page 32) derivative interpreted as the slope of the tangent line. (page 32)
Motivating the need for the derivative and introducing the derivative concept,"Textures (§11) [§11.1, §11.2, §11.3, §11.4]",Jacobian consists of several (partial) derivatives. (page 262)
Motivating the need for the derivative and introducing the derivative concept,"Artistic Principles, Keyframing/Interpolation, Physically-Based, Spring-Mass Models, Behavioral models (§16) [all]",Jacobian consists of several (partial) derivatives. (page 421) Derivative and partial derivatives defined as a limit. (page 426)
Motivating the need for the derivative and introducing the derivative concept,"Blending Functions, Bézier/Hermite, Catmull-Rom, Interpolating vs. Approximating, Subdivision (curves and surfaces), Picewise Curves/Splines (§15) [all]",Points where the derivative is not continuous interpreted graphically. (page 367)
Motivating the need for the derivative and introducing the derivative concept,Defining/Storing/Rendering (§22) [all],Gradient consists of several (partial) derivatives. (page 589)
Defining the derivative as a function,"Signal Processing Concepts (§9)  [§9.1, §9.2, §9.3, §9.4]","The first derivative of a function can be approximated by a finite difference, which then can be expressed as a convolution. "
Defining the derivative as a function,"Artistic Principles, Keyframing/Interpolation, Physically-Based, Spring-Mass Models, Behavioral models (§16) [all]","Graph of a function and its derivative. (page 411) Relationship between position function, velocity function, and acceleration function. (page 414)"
Basic differentiation rules,"Blending Functions, Bézier/Hermite, Catmull-Rom, Interpolating vs. Approximating, Subdivision (curves and surfaces), Picewise Curves/Splines (§15) [all]",Computation of first and second derivatives of a quadratic function. (page 372)
Derivatives of logarithmic and exponential functions,"Vectors, Curves/Surfaces (§2) [all]","The derivatives of logarithmic and exponential functions are presented in order to argue why the natural logarithm is ""natural."" (page 16)"
Implicit differentiation,"Vectors, Curves/Surfaces (§2) [all]",Implicit and explicit equations (page 30)
Implicit differentiation,"Blending Functions, Bézier/Hermite, Catmull-Rom, Interpolating vs. Approximating, Subdivision (curves and surfaces), Picewise Curves/Splines (§15) [all]",Implicit equation of a curve (page 360)
Implicit differentiation,Defining/Storing/Rendering (§22) [all],Implicit equation for a model (page 586)
The shape of graphs (concavity),"Signal Processing Concepts (§9)  [§9.1, §9.2, §9.3, §9.4]","The second derivative of a function can be approximated by a finite difference, which then can be expressed as a convolution. "
Newton's method,Defining/Storing/Rendering (§22) [all],Newton's method applied to find intersections between rays and implicit functions.
Motivating the need for integrals and approximating the area under curves,"Signal Processing Concepts (§9)  [§9.1, §9.2, §9.3, §9.4]",The integral that used in defining the convolution is interpreted as the area under the curve of the product of two functions. (page 194) The scaling of a filter uses some reasoning that relies on the connection between integrals and areas. (page 201)
Motivating the need for integrals and approximating the area under curves,Global Illumination (§23) [all],"The transport equation involves an integral. (pages 614, 617, 620)"
Definite integrals,"Signal Processing Concepts (§9)  [§9.1, §9.2, §9.3, §9.4]",Moving averages smoothing is expresssed as an integral. (page 188) Convolution of two continuous functions is defined using an integral. (page 194) 2D convolutions are defined as integrals. (page 200)
Definite integrals,Defining/Storing/Rendering (§22) [all],Convolution surface expressed as an integral. (page 592)
The fundamental theorem of calculus,"Signal Processing Concepts (§9)  [§9.1, §9.2, §9.3, §9.4]",The computation of two box filter functions relies on computing an integral. (page 194)
"Using integrals for physical applications (work, force, density, mass, etc.)","Artistic Principles, Keyframing/Interpolation, Physically-Based, Spring-Mass Models, Behavioral models (§16) [all]",Hooke's law gives a model for springs.
Calculus II,,
Application to physics,Perception (§19) [all],"The tristimulus values (L, M, S) are expressed as integrals of a spectral composition function. (page 497) Saying that two spectral distributions generate the same color is expressed as 3 intergal equations. "
Introducing the concept of differential equations,Advanced Ray Tracing (§13) [all],Solve a differential equation. (page 325)
Introducing the concept of differential equations,"Artistic Principles, Keyframing/Interpolation, Physically-Based, Spring-Mass Models, Behavioral models (§16) [all]",Moving particle introduced as an ODE.
Parametric equations,"Vectors, Curves/Surfaces (§2) [all]",Parametric curves (pages 39-41)
Parametric equations,"Blending Functions, Bézier/Hermite, Catmull-Rom, Interpolating vs. Approximating, Subdivision (curves and surfaces), Picewise Curves/Splines (§15) [all]",Parametric equation of a curve (page 360) Arc-length parametrization. (page 363)
